### ISSUE TITLE
OSC listener is not receiving events from another machine on High Sierra

### ISSUE THREAD

**Issue by eighteight** [njh/node-red-contrib-osc#16]
I can send OSC messages over the network, but not receive them, if they are coming from a different machine. If I send them from the same machine everything is fine.

I don't have a firewall on, and was wondering how to diagnose this problem.
MacBook Pro 2017
Thanks.

**Comment by natcl** [comment]
What settings are you using in the UDP node ?


--
lecaude.com 
studioimaginaire.com

**Comment by eighteight** [comment]
@natcl my flow is attached. I am broadcasting OSC over UDP from another machine.


[flows.json.zip](https://github.com/njh/node-red-contrib-osc/files/1425274/flows.json.zip)

**Comment by eighteight** [comment]
I jus ran the following command 
```
sudo tcpdump -A 'udp and port 3001'
```

to confirm that osc messages from the net do reach this computer with node-red


```
eight_io-MacBook-Pro:~ eight_io$ sudo tcpdump -A 'udp and port 3001'
tcpdump: data link type PKTAP
tcpdump: verbose output suppressed, use -v or -vv for full protocol decode
listening on pktap, link-type PKTAP (Apple DLT_PKTAP), capture size 262144 bytes
19:46:26.404641 IP 192.168.1.36.ndmp > broadcasthost.redwood-broker: UDP, length 84
..............E..p....@......$....'....\../location/1.,sss....NONE....8508E811-8FC5-4D73-9B73-994EBB74B865....192.168.1.36....
19:46:27.326753 IP 192.168.1.36.ndmp > broadcasthost.redwood-broker: UDP, length 84
..............E..p....@......$....'....\../location/1.,sss....NONE....8508E811-8FC5-4D73-9B73-994EBB74B865....192.168.1.36....
19:46:29.271750 IP 192.168.1.36.ndmp > broadcasthost.redwood-broker: UDP, length 84
..............E..pz...@.=....$....'....\../location/1.,sss....NONE....8508E811-8FC5-4D73-9B73-994EBB74B865....192.168.1.36....
19:46:30.297793 IP 192.168.1.36.ndmp > broadcasthost.redwood-broker: UDP, length 84
..............E..p'|..@..5...$....'....\../location/1.,sss....NONE....8508E811-8FC5-4D73-9B73-994EBB74B865....192.168.1.36....
19:46:31.217488 IP 192.168.1.36.ndmp > broadcasthost.redwood-broker: UDP, length 84
..............E..p....@......$....'....\../location/1.,sss....NONE....8508E811-8FC5-4D73-9B73-994EBB74B865....192.168.1.36....
19:46:32.242078 IP 192.168.1.36.ndmp > broadcasthost.redwood-broker: UDP, length 84
..............E..p....@......$....'....\../location/1.,sss....NONE....8508E811-8FC5-4D73-9B73-994EBB74B865....192.168.1.36....
19:46:33.265481 IP 192.168.1.36.ndmp > broadcasthost.redwood-broker: UDP, length 84
..............E..p....@.+'...$....'....\../location/1.,sss....NONE....8508E811-8FC5-4D73-9B73-994EBB74B865....192.168.1.36....
19:46:33.982378 IP 192.168.1.36.ndmp > broadcasthost.redwood-broker: UDP, length 92
..............E..x....@......$....'....d../devicestate/1..,sss....background..8508E811-8FC5-4D73-9B73-994EBB74B865....192.168.1.36....
19:46:34.187973 IP 192.168.1.36.ndmp > broadcasthost.redwood-broker: UDP, length 84
..............E..p:B..@.~o...$....'....\../location/1.,sss....NONE....8508E811-8FC5-4D73-9B73-994EBB74B865....192.168.1.36....
19:46:35.211226 IP 192.168.1.36.ndmp > broadcasthost.redwood-broker: UDP, length 84
..............E..p#(..@......$....'....\../location/1.,sss....NONE....8508E811-8FC5-4D73-9B73-994EBB74B865....192.168.1.36....
19:46:36.235224 IP 192.168.1.36.ndmp > broadcasthost.redwood-broker: UDP, length 84
..............E..p....@......$....'....\../location/1.,sss....NONE....8508E811-8FC5-4D73-9B73-994EBB74B865....192.168.1.36....
19:46:37.259201 IP 192.168.1.36.ndmp > broadcasthost.redwood-broker: UDP, length 84
..............E..p.;..@..u...$....'....\../location/1.,sss....NONE....8508E811-8FC5-4D73-9B73-994EBB74B865....192.168.1.36....
19:46:38.283181 IP 192.168.1.36.ndmp > broadcasthost.redwood-broker: UDP, length 84
..............E..p....@......$....'....\../location/1.,sss....NONE....8508E811-8FC5-4D73-9B73-994EBB74B865....192.168.1.36....
19:46:39.307169 IP 192.168.1.36.ndmp > broadcasthost.redwood-broker: UDP, length 84
..............E..p....@......$....'....\../location/1.,sss....NONE....8508E811-8FC5-4D73-9B73-994EBB74B865....192.168.1.36....
19:46:40.229788 IP 192.168.1.36.ndmp > broadcasthost.redwood-broker: UDP, length 84
..............E..pkr..@.M?...$....'....\../location/1.,sss....NONE....8508E811-8FC5-4D73-9B73-994EBB74B865....192.168.1.36....
19:46:41.256772 IP 192.168.1.36.ndmp > broadcasthost.redwood-broker: UDP, length 84
..............E..pL...@.l....$....'....\../location/1.,sss....NONE....8508E811-8FC5-4D73-9B73-994EBB74B865....192.168.1.36....
19:46:42.174611 IP 192.168.1.36.ndmp > broadcasthost.redwood-broker: UDP, length 92
..............E..xqq..@.G8...$....'....d../devicestate/1..,sss....foreground..8508E811-8FC5-4D73-9B73-994EBB74B865....192.168.1.36....
19:46:43.301371 IP 192.168.1.36.ndmp > broadcasthost.redwood-broker: UDP, length 84
..............E..p.1..@......$....'....\../location/1.,sss....NONE....8508E811-8FC5-4D73-9B73-994EBB74B865....192.168.1.36....
19:46:44.251092 IP 192.168.1.36.ndmp > broadcasthost.redwood-broker: UDP, length 84
..............E..p....@..!...$....'....\../location/1.,sss....NONE....8508E811-8FC5-4D73-9B73-994EBB74B865....192.168.1.36....
19:46:45.348958 IP 192.168.1.36.ndmp > broadcasthost.redwood-broker: UDP, length 84
..............E..p....@......$....'....\../location/1.,sss....NONE....8508E811-8FC5-4D73-9B73-994EBB74B865....192.168.1.36....

```

**Comment by natcl** [comment]
Check your subnet mask on your network connection, I believe sending to
255.255.255.255 does not always work depending on how your subnet mask is
configured.
You could also try sending to 192.168.1.255 (replace the first 3 bytes with
your network setup)

2017-10-29 12:49 GMT-04:00 eight_io <notifications@github.com>:

**Comment by eighteight** [comment]
Thanks, but 255.255.255.255 -- the sending part works. The receiver does not work though,

**Comment by natcl** [comment]
Check the subnet mask on the receiving computer too

2017-10-29 13:57 GMT-04:00 eight_io <notifications@github.com>:

**Comment by eighteight** [comment]
it's 255.255.255.0

**Comment by natcl** [comment]
I suggest posting to the Node-RED list or Slack as this is not an OSC issue
but a networking one with the built-in UDP node.

2017-10-29 14:16 GMT-04:00 eight_io <notifications@github.com>:
